{
  "id": "urn:ngsi-ld:DETBuildingEnergyProfile:example-001",
  "type": "DETBuildingEnergyProfile",
  "annualCarrierHeatingEnergyDemand": 9000,
  "annualCo2EmissionsTonnes": 3.2,
  "annualElectricalHeatingEnergyDemand": 0,
  "annualElectricalPrimaryEnergyDemand": 5400,
  "annualEnergyCarrierHeatingCost": 533.04,
  "annualEnergyCarrierPrimaryDemand": 9900,
  "annualHeatingEnergyDemand": 9000,
  "annualHouseholdElectricalEnergyCost": 576,
  "annualHouseholdElectricalEnergyDemand": 3000,
  "annualPrimaryEnergyDemand": 14000,
  "annualTotalCost": 2500,
  "annualTotalElectricalEnergyDemand": 3000,
  "annualTotalEnergyDemand": 12000,
  "annualTotalHeatingCost": 1800,
  "currency": "EUR",
  "electricityBaseRate": 50,
  "electricityUnitRate": 0.192,
  "energyCarrierBaseRate": 0,
  "energyCarrierType": "heating_oil",
  "energyCarrierUnit": "L",
  "energyCarrierUnitRate": 0.597,
  "heatingSystemType": "standard_boiler_70_55"
}
